{
  "contract_version": "specification-delta/1",
  "producer": "spec-delta-author",
  "state": "recorded",
  "request_id": "cr_2b4f6a80",
  "changes": [
    {
      "id": "ko.rule.sales.cancelled-order-not-billable",
      "kind": "knowledge-object",
      "operation": "create",
      "reason": "no rule states that a cancelled order may not be invoiced, so the condition is enforced nowhere"
    },
    {
      "id": "ko.lifecycle.sales.order",
      "kind": "knowledge-object",
      "operation": "update",
      "reason": "the cancelled state gains a rejection for the invoice trigger, which totality requires once the rule exists"
    }
  ]
}
